"ID","Name","NumGenes","CorrectedPvalue","Multifunctionality","GeneMemberDiff"
"GO:0001558","regulation of cell growth",399,0.02,0.936,"ABL1, ACVR1B, ACVRL1, ADAM10, ADAM15, ADAM17, ADIPOR2, ADNP, ADNP2, AGT, AGTR1, AKAP6, AKT1, ANAPC2, APBB1, APBB2, APOE, ARHGEF11, ATAD3A, AVP, AVPR1A, BARHL2, BCAR1, BCL11A, BCL2, BDNF, BLZF1, BRAT1, C8orf44-SGK3, CACNG7, CAMK2D, CAV3, CD38, CDC42, CDH4, CDHR2, CDK5R1, CDKN1A, CDKN2AIP, CISH, CLSTN1, CLSTN3, CPNE5, CPNE6, CPNE9, CRABP2, CRKL, CRLF3, CRYAB, CSNK2A1, CTDP1, CTTN, CXCL12, DACT3, DBN1, DBNL, DCBLD2, DCC, DCSTAMP, DDR1, DDX39B, DISC1, DNM2, DNPH1, DRAXIN, DSCAM, EFNA5, EGFR, EGLN2, EIF4G1, EIF4G2, ENO1, ENPP1, ESR2, EXTL3, F2, FAM107A, FAM122A, FGFR1OP, FN1, FRZB, FSTL4, GJA1, GNG4, GREM1, GSK3B, H3F3A, HCLS1, HNF4A, HPN, HSPA1A, HYAL1, HYAL2, IFRD1, IGF1, IGFBP5, IGFBP7, IGFBPL1, INHBA, INO80, INS, ISLR2, IST1, ITCH, JADE1, KDM2B, KLHL22, KRT17, LAMTOR1, LEF1, LGI1, LIMK1, LMX1A, LPAR3, LRP1, MAD2L2, MAG, MAP1B, MAP2, MAP3K13, MAPT, MEGF8, MMP14, MSX1, MT3, MTOR, MTPN, MUC12, MUL1, MYL2, MYOCD, N6AMT1, NAIF1, NDEL1, NDRG3, NDUFA13, NDUFS3, NEDD4L, NGF, NKX6-1, NPM1, NPPB, NPR1, NRCAM, NRG3, NTN1, NTRK3, OLFM1, OSGIN1, OSTN, PAFAH1B1, PAK1, PAPPA2, PHB, PIN1, PLCE1, PLXNA4, POU4F2, PPARD, PPARG, PPP2R1A, PRDM11, PRKCQ, PTCH2, PTK2B, PTPRJ, PTPRS, RAB11A, RASAL1, RASGRP2, RB1, RIMS1, RND2, RNF157, RNF6, ROS1, RPS6KA1, RPTOR, RUFY3, S100A9, SCGB3A1, SEMA3A, SEMA3B, SEMA3C, SEMA3D, SEMA3E, SEMA3F, SEMA3G, SEMA4A, SEMA4B, SEMA4C, SEMA4D, SEMA4F, SEMA4G, SEMA5A, SEMA6A, SEMA6B, SEMA6C, SEMA6D, SEMA7A, SERPINE2, SERTAD2, SFRP1, SFRP2, SGK1, SH3BP4, SIN3A, SIPA1, SIRT1, SLC44A4, SLC9A1, SLIT2, SLIT3, SMAD3, SMAD4, SMARCA2, SMARCA4, SMURF1, SOCS2, SPHK1, SPHK2, SPOCK1, SPP1, ST20, STK11, SYT1, SYT17, SYT2, SYT3, SYT4, TAOK2, TGFB1, TGFB2, TMC8, TMEM97, TNR, TP53, TP53TG5, TRIM40, TRPV2, TTL, UCN, ULK2, UNC13A, URI1, USP47, WDR36, WFDC1, WNT11, WNT3A, WNT5A, WT1"
"GO:0007204","positive regulation of cytosolic calcium ion concentration",283,0.02,0.974,"ABL1, ABL2, ACKR2, ACKR3, ADCY5, ADCYAP1R1, ADRA1A, ADRA1B, ADRA1D, AGT, AGTR1, AKAP6, APLNR, ATP2B4, AVP, AVPR1A, AVPR1B, BDKRB2, C1QTNF1, C3AR1, C5AR1, C5AR2, CACNA1C, CACNA1D, CACNA2D1, CACNB2, CACNB3, CALCA, CALCR, CAPN3, CASQ1, CAV1, CAV3, CCL1, CCL28, CCL3, CCR2, CCR3, CCR5, CCR6, CCR8, CD19, CD36, CD38, CD52, CD55, CHRNA10, CHRNA9, CIB2, CMKLR1, CNR1, CX3CR1, CXCL11, CXCL13, CXCR1, CXCR2, CXCR5, DLG4, DRD2, DRD3, EDNRB, ESR1, F2, FAM155A, FASLG, FGF2, FKBP1B, FPR1, FPR2, FPR3, GALR1, GHRL, GIPR, GJA1, GLP1R, GNA13, GNA15, GNB1, GPR17, GPR18, GPR20, GPR35, GPR4, GPR55, GPR6, GRIN1, GRIN2A, GRIN2B, GRIN2D, GRM1, GSTM2, GSTO1, HAP1, HMGB1, HRH4, HTR2A, HTR2B, HTT, IAPP, ITGAV, ITPR1, ITPR2, ITPR3, JPH2, JPH3, JPH4, KNG1, LACRT, LCK, LETM1, LPAR1, LPAR3, LRP1, LRP6, MCHR1, MCOLN2, MS4A1, NMU, NPSR1, NPTN, NTSR1, OPRL1, OR13F1, OXT, P2RX2, P2RX3, P2RX5, P2RX7, P2RY6, PDGFRA, PIK3CG, PKD1, PKD2, PLA2G6, PLCB1, PLCB2, PLCB3, PLCB4, PLCD1, PLCD4, PLCE1, PLCG1, PLCG2, PLCH1, PLCH2, PLCL1, PLCL2, PLCZ1, PTGDR, PTGER3, PTGFR, PTGIR, PTH1R, PTK2B, PTPRC, RAMP3, RASA3, RIC3, RYR1, RYR2, RYR3, S1PR1, S1PR4, SLC8A1, SLC8A3, SLC8B1, SNCA, SPPL3, SYNPO, TAC4, TACR1, TBXA2R, TGM2, THY1, TMEM38B, TPCN1, TPCN2, TRPC3, TRPC6, TRPM1, TRPM2, TRPV1, TRPV4, TRPV6, XCL1, XCR1"
"GO:0001574","ganglioside biosynthetic process",13,0.02,0.166,"B3GALT4, B4GALNT1, B4GALT5, B4GALT6, ST3GAL5, ST6GALNAC3, ST6GALNAC4, ST6GALNAC5, ST6GALNAC6, ST8SIA2, ST8SIA3, ST8SIA4, ST8SIA6"
"GO:0006646","phosphatidylethanolamine biosynthetic process",13,0.02,0.128,"ALOX15, CEPT1, CHKA, CHKB, ETNK1, ETNK2, ETNPPL, LPIN1, LPIN2, LPIN3, PCYT2, PISD"
"GO:0009214","cyclic nucleotide catabolic process",13,0.02,0.373,"CNP, PDE1A, PDE2A, PDE4A, PDE4B, PDE4C, PDE4D, PDE5A, PDE7A, PDE7B, PDE8A, PDE8B, PDE9A"
"GO:0007601","visual perception",209,0.02,0.67,"ABCA4, AIPL1, AOC2, ATP8A2, ATXN7, BBS1, BBS2, BBS5, BBS7, BBS9, BEST1, BFSP2, CABP1, CABP2, CABP4, CACNA2D4, CACNB2, CDH23, CDH3, CEP250, CHRNB2, CLDN19, CLIC5, CLN8, CLRN1, CNGB1, CNNM4, COL11A1, COL18A1, COL1A1, COL2A1, CPLX3, CPLX4, CRX, CRYAA, CRYBA4, CRYBB1, CRYBB2, CRYBB3, CRYGA, CRYGB, CRYGC, CRYGD, CRYGN, CRYZ, CYP1B1, EFEMP1, EML2, EYA3, EYA4, EYS, FSCN2, GABRR2, GJA3, GNAT1, GRK1, GRM6, GRM8, GUCA1A, GUCY2D, HMCN1, HPS1, HSF4, IMPG1, IMPG2, IRX5, KCNJ10, KIFC3, LAMC3, LRIT3, MFRP, MIP, MYO3A, MYO3B, MYO5A, MYO7A, MYO9A, NR2E1, NRL, NXNL2, OLFM2, OPA1, OPA3, OPN1SW, OPN4, OPN5, PAX2, PAX6, PDCL, PDE6A, PDE6B, PDE6C, PDE6D, PDE6G, PITPNA, POU4F3, POU6F2, PPEF2, PRCD, PRPH2, PRR4, RABGGTA, RABGGTB, RAX, RBP4, RCVRN, RD3, RDH12, RDH8, RGR, RGS9, RGS9BP, RIMS1, RLBP1, ROM1, RP1L1, RPE65, RPGRIP1, SEMA5B, SIX3, SIX6, SLC24A1, SLC24A2, SLC45A2, SLC4A10, TACSTD2, TGFBI, TH, TIMP3, TRPM1, TULP1, TULP2, TYR, USH2A, VAX2, VSX1, VSX2, WDR36, WFS1, ZIC2, ZNF513"
"GO:0007159","leukocyte cell-cell adhesion",46,0.03,0.839,"ADD2, BMP7, CCR2, CD177, CD209, CD44, CERCAM, CLEC4M, CX3CR1, EZR, FERMT3, GCNT1, GOLPH3, ICAM1, ITGA4, ITGA5, ITGAL, ITGB2, JAM2, MADCAM1, NT5E, PODXL2, PTPRC, RAC2, S100A9, SELE, SELL, SELP, SELPLG, SEMA4D, SPN, STK10, TNF, TNIP1, UMOD, VCAM1, ZAP70"
"GO:0060291","long-term synaptic potentiation",46,0.03,0.849,"ARC, CRH, CRHR2, GIP, GRIN2A, GRIN2B, GRIN2D, ITPR3, LRRTM1, LRRTM2, MAPK1, MPP2, NFATC4, NLGN1, NPTN, NR2E1, NTRK2, PRKCZ, PTK2B, PTN, RELN, RGS14, S100B, SERPINE2, SHANK1, SHANK2, SHANK3, SLC24A1, SLC24A2, SLC8A2, SLC8A3, SNAP25, SNAP47, SNCA, STX3, SYT12, TNR"
"GO:1900271","regulation of long-term synaptic potentiation",46,0.02,0.858,"ABL1, ADCY1, ADORA1, ADORA2A, AGER, APOE, APP, ARC, CHRNA7, CREB1, CRTC1, CX3CR1, CYP46A1, DRD2, EIF2AK4, EPHB2, FAM107A, GSK3B, IGSF11, INS, LGMN, LILRB2, MME, NCSTN, NF1, NPTN, NRGN, NSG1, PPP1R9A, PTN, RELN, SCGN, SHANK3, SHISA7, SQSTM1, STAU1, TYROBP"
"GO:0032970","regulation of actin filament-based process",365,0.03,0.945,"ABI2, ABL1, ABL2, ACTN2, ACTR2, ACTR3C, ADD1, ADD2, ADD3, ADORA1, AKAP13, AKAP9, ALMS1, ALOX15, ANK2, ARAP1, ARFGEF1, ARHGAP28, ARHGAP35, ARHGAP40, ARHGAP44, ARHGEF10, ARHGEF10L, ARHGEF15, ARHGEF19, ARPC1B, ARPC2, ARPC3, ARPC4, ARPC5, ARPC5L, ATP1A1, ATP1A2, ATP2A1, ATP2A2, AVIL, BAIAP2, BAIAP2L1, BAIAP2L2, BCAS3, BIN1, BST1, C9orf72, CACNA1C, CAMK2D, CAPG, CAPZA1, CAPZA2, CAPZA3, CAPZB, CAV1, CAV3, CCDC88A, CCL24, CDC42, CDC42EP3, CDC42EP4, CDC42EP5, CDK10, CDK5R1, CELSR1, CLASP1, CNN2, CORO1A, CORO1B, CORO2B, COTL1, CSF1R, CTNNA2, CTNNA3, CTTN, CXCL12, DBN1, DBNL, DIXDC1, DLC1, DLG1, DMTN, DSC2, DSTN, EFNA5, ELN, EPHA5, EPS8, ESAM, EVL, EZR, FAM107A, FCHSD1, FER, FES, FHOD1, FHOD3, FRMD6, FSCN1, FZD10, GATA4, GMFB, GMFG, GRB2, GRHL3, GSN, HCK, HCLS1, HCN4, HIP1R, HRAS, ICAM1, INPP5K, IQGAP2, JAM3, JMY, JUP, KANK1, KANK3, KANK4, KCNJ2, KIAA1211, LATS1, LIMA1, LIMCH1, LIMK1, LMOD1, LMOD3, LPAR1, LRP1, MAGEL2, MIR1-1, MIR133A2, MIR328, MLST8, MTOR, MTPN, MYH9, MYLK2, MYLK3, MYO1C, MYOC, NCK1, NCK2, NCKAP1, NEB, NF2, NOX4, NTRK3, PAK1, PDE4B, PDE4D, PDGFA, PDGFRA, PDGFRB, PDPN, PFN2, PFN3, PFN4, PHLDB2, PHPT1, PICK1, PIK3R1, PLEK, PLEKHG2, PPFIA1, PPM1E, PPM1F, PPP1R9A, PREX1, PRKCE, PROX1, PTK2B, PXN, PYCARD, RAC2, RAPGEF3, RASA1, RDX, RHOBTB1, RHOBTB2, RHOBTB3, RHOC, RHOF, RHOJ, RHOQ, RHOU, RND2, RYR2, S1PR1, SCIN, SCN5A, SEMA3E, SEMA5A, SERPINF2, SFRP1, SH3BP1, SH3PXD2B, SHANK1, SHANK3, SIGLEC15, SLC9A1, SLIT2, SMAD3, SMAD4, SMIM22, SNX9, SORBS3, SPIRE1, SPIRE2, SPTA1, SPTB, SPTBN1, SPTBN2, SPTBN4, SPTBN5, STC1, STMN1, SYNPO, SYNPO2, SYNPO2L, TACSTD2, TAOK1, TAOK2, TGFB3, TMEFF2, TMOD1, TMOD2, TMOD4, TPM1, TRIM27, TRIOBP, TRPM2, VANGL2, VIL1, VILL, WNT11, WNT4"
"GO:0070252","actin-mediated cell contraction",85,0.03,0.971,"ACTC1, ACTN2, ACTN3, ANK2, ATP1A1, CACNA1C, CACNA1D, CACNA1G, CACNA2D1, CACNB2, CAMK2D, CAV3, EMP2, FGF12, FRMD6, GJA1, KCND3, KCNE1, KCNE2, KCNE4, KCNH2, KCNJ2, KCNJ3, KCNJ5, KCNN2, KCNQ1, MYBPC1, MYBPC2, MYH2, MYH3, MYH6, MYH7, MYL1, MYL2, MYL3, MYL4, MYL6, NEB, NEDD4L, PARVA, PDPN, RYR2, SCN1A, SCN1B, SCN2B, SCN3B, SCN5A, SGCD, SLC9A1, TCAP, TMOD1, TNNC2, TNNI1, TNNI2, TNNI3, TNNT1, TNNT2, TNNT3, TPM1, TPM3, TTN, VIL1"
"GO:0014066","regulation of phosphatidylinositol 3-kinase signaling",119,0.03,0.973,"AGT, ANGPT1, BECN1, CD28, CEP55, DAB2IP, DCN, EGFR, ERBB3, ERBB4, F2, FBXL2, FGFR1, FGR, FLT1, FLT3, FSHR, FYN, GAB1, HCLS1, HCST, HGF, IER3, IGF1, IGF1R, INS, INSR, IRS2, KDR, LIME1, LYN, MAPK1, MAZ, MUSK, MYOC, NCF1, NEDD4, NKX3-1, NLRC3, NTRK1, NTRK2, NTRK3, OSM, PDGFA, PDGFB, PDGFC, PDGFD, PDGFRA, PDGFRB, PIK3AP1, PIK3CA, PIK3CB, PIK3CD, PIK3CG, PIK3R1, PIK3R5, PIP4K2A, PIP5K1A, PIP5K1B, PIP5K1C, PLXNB1, PPARD, PPP1R16B, PPP2R5C, PRR5, PRR5L, PTK2, PTPN13, PTPN6, RASGRP1, RELN, RGL2, ROR1, ROR2, SELP, SEMA4D, SERPINA12, SERPINE2, SIRT1, SRC, TGFB2, TNF, TSC2, UNC5B, WNT16"
"GO:1902115","regulation of organelle assembly",211,0.03,0.914,"ADAMTS16, AKAP13, ALMS1, ARHGAP35, ARHGEF2, ASAP1, ATG3, ATG5, ATMIN, BECN1, BRCA1, C10orf90, C9orf72, CAPG, CAV3, CBLN1, CCDC88A, CCSAP, CDK10, CDKL1, CENPJ, CEP120, CEP97, CHMP1A, CHMP4C, CNOT1, CNOT6L, CNTROB, CROCC, CYLD, DCDC2, DNM2, DRG1, DYNC1H1, DZIP1, EVI5, EVI5L, EZR, FEZ2, FSCN1, G3BP2, GAP43, GPSM2, GRID2, GSN, HAP1, HCK, HSPA1A, HTT, IFT140, IL1RAP, IL5, KAT2A, KAT2B, KCTD17, KIAA1324, KIF9, LCP1, LRRC4B, LRRK2, LRRTM1, LRRTM2, MAK, MAP4, MAPK15, MAPK9, MARK4, MDM1, MIR1-1, MNS1, MTMR3, MYLK3, NOTO, NPM1, NPRL2, NPRL3, NRXN1, NTRK3, NUMA1, NUP62, ODF2L, PAN2, PAN3, PATL2, PDCD6IP, PHF23, PIKFYVE, PINK1, PIP4K2A, PLK1, PLK4, PROX1, PTPRD, PTPRS, RAB1B, RAB3GAP2, RAB5A, RABEP2, RALB, RDX, RNF5, SDC1, SDCCAG8, SEPT9, SGSM3, SMAD4, SMCR8, SRC, STAG1, STX18, STYXL1, SYNE2, TAPT1, TBC1D1, TBC1D10A, TBC1D10B, TBC1D10C, TBC1D12, TBC1D14, TBC1D15, TBC1D16, TBC1D17, TBC1D19, TBC1D2, TBC1D21, TBC1D22A, TBC1D24, TBC1D5, TBC1D8, TBC1D9B, TCTEX1D2, TNF, TRAPPC12, TRIM37, ULK1, USP6NL, WRAP73, ZMYND10"
"GO:0007193","adenylate cyclase-inhibiting G protein-coupled receptor signaling pathway",82,0.03,0.943,"ADCY1, ADCY2, ADCY3, ADCY4, ADCY5, ADCY6, ADCY7, ADCY9, ADORA1, AKAP12, AKAP5, CASR, CHRM1, CHRM2, CHRM3, CHRM4, CHRM5, DRD2, DRD3, FFAR3, FPR2, GABBR1, GNAI2, GNAI3, GNAL, GNAT3, GNAZ, GPR176, GPR37L1, GRIK3, GRM2, GRM3, GRM4, GRM6, GRM7, GRM8, HRH3, HRH4, HTR1B, HTR5A, INSL3, LPAR1, MARCO, MCHR1, MTNR1A, NPR3, NPY1R, OPRD1, OPRK1, OPRL1, OPRM1, OR13F1, P2RY12, PALM, PDE2A, PTGDR2, RIC8A, RXFP2, S1PR1, SSTR2"
"GO:0048589","developmental growth",372,0.03,0.971,"ABL1, ACVR2B, ADAM15, ADARB1, ADD1, ADRA1A, AGT, AKAP13, ALCAM, ANKRD11, ANXA6, APBA1, APBA2, APOA5, APP, ARID5B, ARIH2, ATF5, AUTS2, BCL2, BCL9, BDNF, BIN3, BMP4, BMPR1B, BNC2, C9orf72, CCM2, CCM2L, CCNB1, CD81, CD9, CDKN1A, CDKN1C, CELA1, CFLAR, CHRNA1, CHRND, CHST11, COBL, COL12A1, COL14A1, COL20A1, COL27A1, COL6A1, COL6A2, COL6A3, COL7A1, CPQ, CTC1, CTNNB1, CYFIP2, CYP19A1, DCLK1, DDR1, DDR2, DYSF, ECM1, EFNA5, EIF2AK4, EIF4H, EMX1, ENO3, ERBB4, ERCC1, ESR1, ETNK2, EVC, EYS, FGF7, FGFR2, FGFR3, FKBP8, FLRT1, FZD9, G6PC, GAP43, GAS2, GATA3, GATA4, GIGYF2, GINS4, GLI2, GLI3, GNAS, GPD2, GPR149, GPX1, GRHL2, GSN, H3F3A, HOXA11, HSP90AB1, IFRD1, IGF1, IQGAP1, ITGA4, KAT2A, KIF26B, KLF5, KMT2D, LEPR, LGR6, LHX2, LLPH, LRP6, MAGI2, MAP1B, MAP2K4, MATN1, MATN2, MATN4, MBL2, MED1, MESP1, MIR23A, MMP13, MTOR, MTPN, MYF6, MYOD1, MYOG, NBN, NCAPG2, NDEL1, NDN, NDRG4, NIN, NINJ2, NIPBL, NOTCH1, NPPC, NRP2, OSTN, PALB2, PAX7, PDE4D, PDGFRB, PLAG1, PLEKHA1, PLXNA1, POC1A, POSTN, POU4F2, POU4F3, PPP1R13L, PPP3CB, PRKAR1A, PRKCZ, PRMT2, PTGFRN, PTK7, PTN, PYGO2, RARA, RARB, RARG, RBBP6, RTF1, RXRA, S1PR1, SALL1, SALL4, SCARA3, SEMA3A, SEMA3F, SEMA5A, SEMA5B, SEMA7A, SFRP1, SFRP2, SGCA, SH3GL2, SHANK1, SHANK2, SHANK3, SHH, SIRT6, SLC12A5, SLC1A2, SLC25A25, SLC4A10, SLIT1, SLIT2, SLIT3, SLITRK1, SMAD2, SMAD3, SMAD4, SMPD3, SORBS2, SOX10, SOX15, SOX2, SPG11, SPTBN2, STC1, STK11, STK40, STRA6, TAF8, TARBP2, TBX2, TEC, TENM4, TGFB2, TGFBR3, THBS3, TIAM1, TM4SF4, TMEM108, TMEM38B, TNC, TP53, ULK1, ULK2, UNC79, VANGL2, VCL, VIT, VWA1, WDR11, WDR48, WDTC1, WNT11, WNT3A, WNT5A, WNT7A, WNT7B, WWTR1, XPA, YAP1, ZEB2, ZMIZ1, ZMPSTE24"
"GO:0051282","regulation of sequestering of calcium ion",130,0.03,0.988,"ABL1, AKAP6, ANK2, ANXA5, ANXA6, APLNR, ATG5, ATP1A2, CACNA1C, CAMK2D, CAPN3, CASQ1, CASQ2, CCL3, CCR5, CD19, CHD7, CORO1A, CXCL11, DHRS7C, DRD2, F2, FASLG, FGF2, FKBP1A, FKBP1B, GSTM2, GSTO1, HAP1, HRC, HTR2A, HTR2B, HTT, ITPR1, ITPR2, ITPR3, JPH2, JPH3, JPH4, LACRT, LCK, LETM1, LIME1, LYN, MCOLN2, METTL21C, MIR1-1, MIR133A2, MYO5A, NOS1, NPSR1, NTSR1, P2RX7, P2RY6, PDE4D, PKD2, PLCB1, PLCB2, PLCB3, PLCB4, PLCD1, PLCD4, PLCE1, PLCG1, PLCG2, PLCH1, PLCH2, PLCL1, PLCL2, PLCZ1, PRKCE, PTK2B, PTPN6, PTPRC, RASA3, RYR1, RYR2, RYR3, SLC8A1, SLC8B1, SNCA, THY1, TMEM38B, TPCN1, TPCN2, TRPM2, TRPV1, UBASH3B, XCL1, XCR1"
"GO:0021510","spinal cord development",102,0.03,0.946,"ABT1, ACTL6A, ACTL6B, ADARB1, AKT1, CHRD, CLN8, DAAM2, DAB1, DBX1, DCC, DCTN1, DMRT3, DRAXIN, DRGX, DYNC2H1, FOXN4, GBX1, GDF7, GDNF, GDPD5, GIGYF2, GLI2, GLI3, HOXC10, HOXD10, IFT172, INTU, LHX3, LHX4, LHX5, LOXL3, MDGA1, MDGA2, MNX1, MPST, MTOR, NF1, NFE2L1, NKX2-2, NKX6-1, NOTCH1, OLIG3, PAX6, PAX7, PBX3, PHGDH, PHOX2A, PKD1, PKD2, PLXDC1, PROX1, PTBP2, PTCH1, PTN, PTPRS, RELN, RFX4, RFX8, ROBO2, SHH, SOX1, SOX4, SUFU, TAL1, TBX20, TCTN1, UNCX, VIT, VLDLR, VSTM5, WNT3A, ZIC1"
"GO:0002697","regulation of immune effector process",382,0.03,0.987,"A2M, ABR, AGER, AIM2, ANGPT1, ANKRD17, AP1G1, APLF, APOBEC3G, APPL2, ARRB2, ATAD5, ATG5, BCL10, BCR, C17orf99, C1QA, C1QBP, C1R, C1S, C2, C3, C3AR1, C5AR1, C5AR2, C6, C7, C8B, C8G, CADM1, CCR2, CD160, CD177, CD19, CD1A, CD1B, CD22, CD226, CD244, CD28, CD300A, CD36, CD55, CD59, CD5L, CD80, CD81, CD84, CD86, CFB, CFH, CFHR2, CFI, CLEC12B, CLNK, CLU, CPB2, CPN2, CR1, CR1L, CR2, CRTAM, CXCL6, DDX1, DDX21, DHX9, DNASE1, DNASE1L3, DTX3L, DUSP10, DUSP22, EIF2AK4, ENPP3, EXOSC3, F2, FADD, FAM49B, FBXO38, FCER1G, FCER2, FCGR2B, FCRL3, FER, FES, FFAR2, FFAR3, FGR, FOXF1, FOXJ1, FZD5, GAB2, GATA3, GPATCH3, GPI, GPRC5B, GRN, HAVCR2, HERC5, HK1, HLA-DMB, HLA-E, HLA-F, HLX, HMGB1, HPX, HSPD1, HTRA1, IFNG, IFNL1, IL12A, IL12RB1, IL15, IL18R1, IL18RAP, IL1R1, IL20RB, IL21, IL23A, IL23R, IL27, IL27RA, IL2RA, IL4, IL4R, IL5, IL7R, INS, ITCH, ITGAM, ITGB2, JAK3, KIR2DL4, KLK5, KLK7, LAG3, LAMP1, LBP, LGALS3, LGALS9, LILRB1, LOXL3, LTA, LYN, MAD2L2, MALT1, MAP3K7, MAPK14, MICA, MIF, MIR520B, MSH2, MUL1, MYB, MYO18A, MZB1, NCR1, NCR3, NDFIP1, NFKBID, NLRP3, NLRX1, NOD2, NPLOC4, NR4A3, P2RX7, PARP3, PAXIP1, PGC, PGLYRP2, PGLYRP3, PGLYRP4, PHB, PKN1, PPP3CB, PRAM1, PRKCZ, PRKDC, PROS1, PTAFR, PTPN6, PTPRC, PTPRJ, PUM1, PUM2, PVR, PYCARD, RAC2, RAET1E, RAP1A, RAPGEF1, RARA, RASGRP1, RBP4, RIOK3, RNF125, RSAD2, SEC14L1, SEMA7A, SERPING1, SIN3A, SMAD7, SNX6, SPHK2, SPINK5, SPON2, STAT1, STAT5B, STAT6, STXBP1, STXBP2, SUSD4, TARBP2, TBX21, TGFB1, TGFB2, TGFB3, TLR9, TMBIM6, TNF, TNFRSF1B, TNFSF13, TNFSF4, TP53BP1, TRAF2, TRAF3, TRAF3IP1, TRAF3IP2, TRIL, TRIM15, TRIM44, TRIM6, TSPAN32, VAMP8, VAV1, VTN, WNT5A, XBP1, XCL1, ZBTB7B, ZCCHC3, ZMPSTE24, ZNF683, ZP3"
"GO:0050433","regulation of catecholamine secretion",55,0.03,0.863,"ABAT, ADORA2A, AGT, CARTPT, CHGA, CHRNA6, CHRNB2, CNR1, CRH, CXCL12, DRD2, DRD3, DTNBP1, FFAR3, FGF20, GDNF, HRH3, HTR1B, HTR2A, KCNA2, KCNB1, OR13F1, OXT, P2RY12, PINK1, SNCA, SNCG, STX1A, SYT1, SYT10, SYT12, SYT13, SYT15, SYT17, SYT2, SYT3, SYT4, SYT5, SYT6, SYT7, SYT9, VIP"
"GO:0060048","cardiac muscle contraction",76,0.03,0.884,"ACTC1, ANK2, ATP1A1, ATP1A2, CACNA1C, CACNA1D, CACNA1G, CACNA2D1, CACNB2, CAMK2D, CASQ2, CAV3, CSRP3, FGF12, GAA, GJA1, KCND3, KCNE1, KCNE2, KCNE4, KCNH2, KCNJ2, KCNJ3, KCNJ5, KCNN2, KCNQ1, MAP2K3, MTOR, MYH6, MYH7, MYL1, MYL2, MYL3, MYL4, MYLK2, NEDD4L, PIK3CA, PPP1R13L, RYR2, SCN1A, SCN1B, SCN2B, SCN3B, SCN5A, SGCD, SLC8A1, SLC9A1, SMAD5, TCAP, TNNI1, TNNI2, TNNI3, TNNT1, TNNT2, TNNT3, TPM1, TTN"
"GO:0017157","regulation of exocytosis",216,0.03,0.972,"ABR, ADCY1, ADORA2A, ADRA1A, AP1G1, APBA1, APBA2, ATP13A2, ATP2A2, BACE1, BAIAP3, BCR, CACNA1D, CACNA1G, CACNA1H, CACNA1I, CACNB2, CADPS, CADPS2, CCR2, CD177, CD300A, CD84, CFTR, CHMP6, CHRM2, CHRNA6, CHRNB2, CHRNB3, CLASP1, CNR1, CPLX1, CPLX2, CPLX3, DGKI, DNM1L, DOC2A, DOC2B, DRD2, DTNBP1, FCER1G, FCGR2B, FER, FES, FGA, FGB, FGG, FGR, FOXF1, GAB2, GIPC1, GIT1, GNAI2, GRIK5, GRIN3A, GSK3B, HAP1, HGS, HLA-F, HTR1B, HTR2A, HYAL3, IFNG, IL4R, ITGAM, ITGB2, KCNB1, LAMP1, LGALS9, LGI3, LRRK2, LYN, NAPA, NAPB, NCS1, NLGN1, NOTCH1, P2RX1, PCLO, PDCD6IP, PFN2, PLA2G6, PPFIA2, PRAM1, PRKCB, PRKCG, PTAFR, RAB10, RAB15, RAB27A, RAB27B, RAB3B, RAB3C, RAB5A, RAB7A, RAB8A, RAC2, RALA, RALB, RAP1A, RAPGEF4, REST, RIMS1, RIMS3, RIMS4, RPH3AL, SCAMP5, SDC1, SEPT1, SEPT4, SEPT5, SMPD3, SNCA, SNF8, SNX6, SPHK2, STX1A, STX1B, STXBP1, STXBP2, STXBP3, STXBP5L, SYT1, SYT10, SYT12, SYT13, SYT15, SYT17, SYT2, SYT3, SYT4, SYT5, SYT6, SYT7, SYT9, TRIM9, TRPV6, UNC13B, VAMP8, VPS4A, VSNL1, WNT7A, ZP3"
"GO:0045927","positive regulation of growth",258,0.03,0.985,"ACTN3, ADAM10, ADAM17, ADNP, ADNP2, AGR2, AGRN, AKAP6, AKT1, ANAPC2, ATP8A2, AVP, AVPR1A, BASP1, BBS2, BCL2, BDNF, BRAT1, CACNA2D2, CACNG7, CAPN3, CCNB1, CD38, CDC42, CDH4, CDK1, CDKN2AIP, CHD7, CPNE5, CPNE6, CPNE9, CRABP2, CREB1, CSHL1, CSNK2A1, CTTN, CXCL12, DBN1, DBNL, DDX39B, DISC1, DNPH1, DRD2, DSCAM, EFNA5, EGFR, EIF4G1, EIF4G2, ERBB4, EXTL3, EZR, F2, FAM122A, FGF2, FGF8, FGFR1, FGFR1OP, FGFR2, FN1, FOXS1, GHR, GHRH, GHRHR, GHRL, GLI1, GPAM, H3F3A, HCLS1, HEY2, HLX, HPN, HSF1, HYAL1, IGF1, IGF2, IL7, INO80, INS, INSR, ISLR2, IST1, KDM2B, KLHL22, KRT17, LEF1, LGI1, LIMK1, LPAR3, LRP1, MAP1B, MAP3K13, MAPK1, MAPK14, MAPT, MEGF8, MIR204, MMP14, MTOR, MTPN, MUL1, MYOD1, N6AMT1, NDEL1, NEDD4L, NGF, NIPBL, NOTCH1, NTN1, NTRK3, PAFAH1B1, PAK1, PIN1, PLCB1, POU3F2, POU4F2, PPARD, PPM1F, PRKDC, PROX1, PTK2B, RAB11A, RAG2, RASAL1, RBPJ, RFTN1, RIMS1, RND2, RNF157, RPS6KA1, RPTOR, RUFY3, S100A9, SEMA4D, SEMA5A, SEMA7A, SFRP1, SFRP2, SH3PXD2B, SLC44A4, SLC6A3, SLC9A1, SMURF1, SOX15, SPHK1, SPTBN4, STAT5B, SYT1, SYT17, SYT2, SYT3, SYT4, TBX2, TBX20, TBX5, TFCP2L1, TGFB2, TGFBR3, TRPV2, UCN, UNC13A, USP47, VIL1, WFS1, WNT2, WNT3A, WT1, YAP1, ZFPM2, ZP3"
"GO:0098659","inorganic cation import across plasma membrane",70,0.03,0.816,"ABCC9, ATP12A, ATP1A1, ATP1A2, ATP1A3, ATP1A4, ATP1B3, ATP2B4, ATP4A, CACNA2D1, FAM155A, FXYD2, HCN2, HCN4, KCNE2, KCNH2, KCNJ1, KCNJ10, KCNJ11, KCNJ12, KCNJ14, KCNJ15, KCNJ16, KCNJ2, KCNJ3, KCNJ5, KCNJ6, KCNJ9, KCNK5, KCNK9, SLC12A1, SLC12A3, SLC12A4, SLC12A5, SLC12A6, SLC12A7, SLC12A8, SLC12A9, SLC34A1, SLC39A10, SLC39A12, SLC39A14, SLC39A4, SLC8A1, SLC8A3, SLC9A1, SLC9A3, SLC9A9, SLC9C1, SLC9C2, TRPM2, TRPV1, TRPV6"
"GO:0099587","inorganic ion import across plasma membrane",70,0.03,0.816,"ABCC9, ATP12A, ATP1A1, ATP1A2, ATP1A3, ATP1A4, ATP1B3, ATP2B4, ATP4A, CACNA2D1, FAM155A, FXYD2, HCN2, HCN4, KCNE2, KCNH2, KCNJ1, KCNJ10, KCNJ11, KCNJ12, KCNJ14, KCNJ15, KCNJ16, KCNJ2, KCNJ3, KCNJ5, KCNJ6, KCNJ9, KCNK5, KCNK9, SLC12A1, SLC12A3, SLC12A4, SLC12A5, SLC12A6, SLC12A7, SLC12A8, SLC12A9, SLC34A1, SLC39A10, SLC39A12, SLC39A14, SLC39A4, SLC8A1, SLC8A3, SLC9A1, SLC9A3, SLC9A9, SLC9C1, SLC9C2, TRPM2, TRPV1, TRPV6"
"GO:0032963","collagen metabolic process",61,0.03,0.416,"ADAM15, ADAMTS14, ADAMTS2, ADAMTS3, COL13A1, COL15A1, COL1A1, COL1A2, COL5A1, CTSB, HIF1A, MMP1, MMP11, MMP13, MMP14, MMP15, MMP16, MMP17, MMP19, MMP2, MMP20, MMP21, MMP23B, MMP24, MMP25, MMP26, MMP9, MRC2, P2RX7, PEPD, PHYKPL, PLOD1, PLOD2, PLOD3, PRTN3, SERPINH1, SMPD3, TMPRSS6, TNXB, TRAM2, VIPAS39, VPS33B"
"GO:0009187","cyclic nucleotide metabolic process",39,0.03,0.778,"ADCY1, ADCY10, ADCY2, ADCY3, ADCY4, ADCY5, ADCY6, ADCY7, ADCY9, AMPD2, CNP, EPHA2, GUCY2D, NPPB, NPPC, NPR1, NPR2, PDE1A, PDE2A, PDE4A, PDE4B, PDE4C, PDE4D, PDE5A, PDE7A, PDE7B, PDE8A, PDE8B, PDE9A, RORA"
"GO:0043270","positive regulation of ion transport",263,0.03,0.999,"ABAT, ABCA7, ABCB1, ABCB4, ABL1, ACTN2, ACTN4, ADCYAP1R1, ADORA1, ADORA2A, AGT, AHCYL1, AKAP6, AKAP9, AKT1, ANK2, ANK3, APLNR, APOE, ARC, ARRB2, ATF4, ATP1B3, ATP2A1, ATP2B1, ATP8A1, ATP8A2, AVP, AVPR1A, CACNA1D, CACNA2D1, CACNB2, CACNB3, CACNG2, CACNG3, CACNG4, CALCR, CAMK2A, CAPN3, CASQ1, CASR, CAV1, CCK, CCL3, CCR2, CD19, CFTR, CHP1, CHRM1, CHRNB2, CNKSR3, CNTN1, CRH, CXCL11, CXCL12, CYP4F2, DLG1, DNM2, DRD2, EDN3, EHD3, EPHB2, F2, FABP3, FFAR1, FGF12, FGF14, FXYD1, GCG, GDNF, GJC2, GLRX, GRIN1, GRM6, GSTM2, GSTO1, HAP1, HOMER1, HSPA2, HTR3A, HTT, IFNG, JPH2, KCNC1, KCNC2, KCNE1, KCNE2, KCNH2, KCNIP2, KCNJ11, KCNJ2, KCNMB1, KCNQ1, KMO, LACRT, LGALS3, LILRA2, LILRA5, LPAR3, LRRC38, LRRC55, MCHR1, MIF, MIR1-1, MYLK, NOS1, NPSR1, NTSR1, OXT, P2RX1, P2RX2, P2RX3, P2RX5, P2RX7, P2RY12, P2RY6, PARK7, PDGFB, PDGFRB, PDZK1, PINK1, PIRT, PKD2, PLA2G6, PLA2R1, PLCG1, PLCG2, PRSS8, PSEN1, PTAFR, RAB3B, RAMP3, RELN, RGS9, RYR2, S100A1, SCN1B, SCN3B, SCN5A, SHANK3, SLC34A1, SLC38A3, SLC6A1, SLC6A4, SLC9A1, SNCA, SPHK2, STAC, STAC2, STAC3, STC1, STIM1, STK39, STXBP1, SYT4, TACR2, THY1, TNFSF11, TRH, TRIAP1, TRPC3, TRPC6, TRPV2, TRPV3, TSPO, UCN, VAMP8, WFS1, WNK1, WNK2, XCL1"
"GO:0051494","negative regulation of cytoskeleton organization",135,0.03,0.93,"ADD1, ADD2, ADD3, APC, APC2, ARAP1, ARFGEF1, ARHGAP28, ARHGEF2, AVIL, BRCA1, C16orf45, CAMSAP3, CAPG, CAPZA1, CAPZA2, CAPZA3, CAPZB, CAV3, CDH5, CLASP1, CLIP3, CORO1A, CORO1B, CORO2B, CTNNA2, DLC1, DMTN, EML2, EPS8, ESPN, FHOD3, GMFB, GMFG, GSN, HIP1R, INPP5J, INPP5K, KANK1, KANK3, KANK4, KAT2A, KAT2B, KIF25, LIMA1, LMOD1, LMOD3, MAP1B, MAP2, MAP6D1, MAPRE1, MDM1, MYOC, NAV3, NEK2, NPM1, PFN2, PFN4, PHLDB2, PICK1, PPFIA1, PPP1R9A, RDX, S1PR1, SCIN, SHANK1, SHANK3, SLIT2, SMAD4, SNCA, SPEF1, SPTA1, SPTB, SPTBN1, SPTBN2, SPTBN4, SPTBN5, STMN1, STMN2, TACSTD2, TAOK1, TBCD, TMEFF2, TMEM67, TMOD1, TMOD2, TMOD4, TRIM37, TRIM54, TRIOBP, TTBK2, TUBB4A, VIL1, VILL"
"GO:1905475","regulation of protein localization to membrane",181,0.03,0.982,"ACSL3, ACTB, ADAM10, AGR2, AKAP5, AKT1, AKT2, ANK3, ANXA13, AP2B1, ARHGAP44, ARHGEF16, BAD, BBC3, BCL2, BID, C2CD5, CACNB3, CACNG2, CASP8, CD81, CDH2, CDK5R1, CHP1, CLIP3, CNPY4, CNST, CRIPT, CRKL, CSK, CSRP3, DLG1, DMTN, DPP10, EGFR, EPHA2, EPHB2, EZR, FYN, FZD9, GOPC, GPC1, GPC2, GPC5, GPC6, GRASP, GSN, GZMB, HPCA, HRAS, IFNG, INPP5K, INS, ITGAM, ITGB2, KCNB1, KCNE1, KCNJ11, LGALS3, LRP1, LZTFL1, MAPK8, MIEF1, MIEF2, MMP14, MRAP, MYO1C, NECAB2, NHLRC1, NKD2, NMT1, NUMB, PAK1, PDZK1, PICALM, PIK3R1, PPFIA1, PPP1R13B, PPP3CC, PPP3R1, PRKCE, PRKCH, PRKCZ, PTN, PTPN9, RAB11A, RAB11FIP2, RAMP3, RAP1A, RER1, RHOQ, SHISA6, SHISA7, SLC51B, SLC7A11, SORBS1, SPTBN1, SQSTM1, SSH1, STAC, STAC2, STAC3, STOM, STX3, TFDP1, TFDP2, TGFB1, TNF, TP53, TP63, TP73, VAMP8, VIL1, VPS4A, VTI1B, WNT3A, YWHAB, YWHAE, YWHAG, YWHAQ, ZMYND8"
"GO:0098693","regulation of synaptic vesicle cycle",110,0.03,0.989,"ADCY1, ADORA2A, ADRA1A, APBA1, APBA2, ATP2A2, BACE1, BRSK1, BRSK2, BSN, BTBD9, CACNA1D, CACNB2, CDH2, CDK5R1, CHRM2, CHRNA6, CHRNB2, CHRNB3, CNR1, CPLX1, CPLX2, CPLX3, DGKI, DGKQ, DNAJC5, DNM1, DNM1L, DNM3, DRD2, DTNBP1, FGF14, GIPC1, GIT1, GRIK5, GRIN3A, GSK3B, HTR1B, HTR2A, LRRK2, MAGI2, NAPA, NAPB, NCS1, NLGN1, NLGN2, NRXN1, P2RX1, PCDH17, PFN2, PLD1, PPFIA2, PPP3CB, PPP3CC, PRKAR1B, PRKCB, PRKCG, RAB3B, RAB5A, RAP1A, RAPGEF4, RIMS1, RIMS3, RIMS4, SEPT5, SH3GL1, SLC17A7, SNCA, STX1A, STX1B, STXBP1, STXBP5L, SYT1, SYT4, SYT7, SYT9, TOR1A, UNC13B, WNT7A"
"GO:0006688","glycosphingolipid biosynthetic process",25,0.03,0.429,"A3GALT2, A4GALT, B3GALT1, B3GALT4, B4GALNT1, B4GALT3, B4GALT5, B4GALT6, ST3GAL5, ST6GALNAC3, ST6GALNAC4, ST6GALNAC5, ST6GALNAC6, ST8SIA1, ST8SIA2, ST8SIA3, ST8SIA4, ST8SIA5, ST8SIA6, UGCG, UGT8"
"GO:0048596","embryonic camera-type eye morphogenesis",25,0.03,0.832,"ALDH1A3, ARID1A, BMP7, FOXF2, FRS2, FZD5, HIPK1, HIPK2, KDM2B, LRP6, PAX2, PAX6, PHACTR4, PROX1, SIX3, STRA6, TBX2, TFAP2A, TH, WNT16, WNT5A, ZEB1"
"GO:0015804","neutral amino acid transport",32,0.03,0.706,"CTNS, NFE2L1, NFKBIE, SLC1A1, SLC1A4, SLC1A5, SLC36A1, SLC36A2, SLC36A3, SLC38A1, SLC38A2, SLC38A3, SLC38A7, SLC38A9, SLC3A1, SLC3A2, SLC43A1, SLC43A2, SLC6A17, SLC6A19, SLC6A20, SLC6A5, SLC6A7, SLC6A9, SLC7A5, SLC7A8, SLC7A9"
"GO:0001573","ganglioside metabolic process",21,0.03,0.479,"B3GALT4, B4GALNT1, B4GALT5, B4GALT6, GM2A, HEXB, ITGB8, NEU1, NEU3, NEU4, ST3GAL5, ST6GALNAC3, ST6GALNAC4, ST6GALNAC5, ST6GALNAC6, ST8SIA2, ST8SIA3, ST8SIA4, ST8SIA6"
"GO:0006493","protein O-linked glycosylation",115,0.03,0.42,"B3GALNT1, B3GALT1, B3GALT4, B3GALT5, B3GALT6, B3GNT2, B3GNT4, B3GNT5, B3GNT6, B3GNT7, B4GALT5, CHST4, DPM1, DPM2, EOGT, FKRP, FKTN, GALNT1, GALNT10, GALNT11, GALNT12, GALNT14, GALNT16, GALNT18, GALNT3, GALNT7, GALNT8, GALNT9, GALNTL6, GCNT1, ISPD, KDELC2, LFNG, MGAT5B, MUC12, MUC15, MUC16, MUC17, MUC19, MUC2, MUC21, MUC3A, MUC4, MUC5AC, MUC5B, MUC6, MUC7, MUCL1, PLOD1, PLOD2, PLOD3, POFUT1, POFUT2, POMGNT1, POMGNT2, POMT1, POMT2, RFNG, SLC35C1, SLC35C2, ST3GAL1, ST3GAL2, ST3GAL3, ST3GAL4, ST6GAL1, ST6GALNAC2, ST6GALNAC4, ST8SIA6, TET1, TET2, TET3, TMTC1, TMTC2, TRAK1, TRAK2, XXYLT1"
"GO:0099504","synaptic vesicle cycle",115,0.03,0.956,"ACTB, ACTBL2, ACTG1, AMPH, AP3D1, BRSK1, CADPS, CADPS2, CPLX1, CPLX2, CPLX3, CPLX4, CTBP2, CTNNB1, DDC, DENND1A, DNAJC5, DNAJC6, DNM1, DNM1L, DNM2, DNM3, DOC2A, DOC2B, ERC2, FCHO2, GAK, MX2, NAPA, NLGN1, NLGN2, OTOF, P2RX7, PACSIN1, PCLO, PICALM, PIP5K1C, PLD2, PPFIA3, PSEN1, RAB27B, RAB5A, RIMS1, RIMS3, RIMS4, SEPT5, SH3GL1, SH3GL2, SLC17A7, SLC18A1, SLC18A2, SNAP23, SNAP25, SNAP47, SNAP91, SNCA, SNCB, STON2, STX11, STX1A, STX1B, STX2, STX3, STX6, STXBP1, SV2A, SYN2, SYNDIG1, SYT1, SYT10, SYT12, SYT2, SYT5, SYT7, SYT9, TH, TRIM9, UNC13A, UNC13B, UNC13C, WNT3A, WNT7A"
